{
  "version": 1,
  "mode": "review",
  "title": "Document diagram playback controls",
  "summary": "The README adds guidance for System, Play, and Pause.",
  "context": {
    "baseline": "The previous README had no playback guidance.",
    "scope": "README playback paragraph only.",
    "comparison": {
      "base": "552990a7a0e037d4c7b1d2a7cd533d28ae456e64",
      "head": "e7a4f99e24cd1e4e1daa228cc84c21d0bee04a05",
      "inspectedAt": "2026-10-03",
      "included": [
        "README.md:33 at the pinned revision"
      ],
      "excluded": [
        "Current working tree changes",
        "Renderer implementation and browser verification"
      ]
    }
  },
  "changes": [
    {
      "id": "playback-docs",
      "title": "Explain the three playback options",
      "status": "new",
      "description": "System follows the motion preference; Play enables motion for the report; Pause freezes playback.",
      "evidence": [
        {
          "label": "Read the inspected README paragraph",
          "file": "README.md",
          "line": 33,
          "revision": "e7a4f99e24cd1e4e1daa228cc84c21d0bee04a05",
          "url": "https://github.com/Nielk74/ouat/blob/e7a4f99e24cd1e4e1daa228cc84c21d0bee04a05/README.md#L33",
          "detail": "Inspected with git show at the pinned revision; browser behavior is unverified."
        }
      ]
    }
  ],
  "impact": [
    {
      "change": "playback-docs",
      "basis": "inferred",
      "description": "May help readers recognize intentional static playback."
    }
  ]
}
