{
  "version": 1,
  "mode": "plan",
  "title": "Recover transient request failures",
  "summary": "Retry safe transient failures within the existing deadline.",
  "context": {
    "baseline": "One upstream attempt; a failure ends the request.",
    "scope": "Hypothetical proposal; project code and production behavior are unverified.",
    "constraints": [
      "Preserve the response shape and deadline."
    ],
    "assumptions": [
      "Confirm operation safety and failure classification with upstream contracts."
    ],
    "visual": {
      "template": "dependency-map",
      "nodes": [
        {
          "id": "client",
          "label": "Client",
          "status": "unchanged"
        },
        {
          "id": "service",
          "label": "Request service",
          "status": "unchanged"
        },
        {
          "id": "upstream",
          "label": "Upstream system",
          "status": "unchanged"
        }
      ],
      "edges": [
        {
          "from": "client",
          "to": "service",
          "label": "Existing request / response contract",
          "status": "unchanged",
          "shortLabel": "Request"
        },
        {
          "from": "service",
          "to": "upstream",
          "label": "Current single upstream attempt",
          "status": "unchanged",
          "issue": "A transient failure ends the request without another attempt.",
          "shortLabel": "Single attempt"
        }
      ]
    }
  },
  "changes": [
    {
      "id": "retry-policy",
      "title": "Introduce a bounded retry policy",
      "status": "new",
      "description": "Add a bounded retry policy for eligible transient failures.",
      "visual": {
        "template": "before-after",
        "before": [
          {
            "label": "Initial upstream attempt",
            "status": "unchanged"
          },
          {
            "label": "Every failure immediately ends the request",
            "status": "removed"
          },
          {
            "label": "Existing response format",
            "status": "unchanged"
          }
        ],
        "after": [
          {
            "label": "Initial upstream attempt",
            "status": "unchanged"
          },
          {
            "label": "Bounded retry policy",
            "status": "new",
            "animate": true
          },
          {
            "label": "Existing response format",
            "status": "unchanged"
          }
        ]
      }
    },
    {
      "id": "eligibility",
      "title": "Make retry eligibility explicit",
      "status": "changed",
      "description": "Require a safe operation, transient error, attempt budget, and time budget before retrying.",
      "visual": {
        "template": "flow",
        "nodes": [
          {
            "id": "attempt",
            "label": "Make upstream attempt",
            "status": "unchanged"
          },
          {
            "id": "result",
            "label": "Return existing result",
            "status": "unchanged"
          },
          {
            "id": "eligible",
            "label": "Retry allowed?",
            "status": "new",
            "kind": "decision"
          },
          {
            "id": "wait",
            "label": "Wait within deadline",
            "status": "new"
          }
        ],
        "edges": [
          {
            "from": "attempt",
            "to": "result",
            "label": "Success",
            "status": "unchanged",
            "transport": "flow"
          },
          {
            "from": "attempt",
            "to": "eligible",
            "label": "Failure",
            "status": "changed",
            "transport": "flow",
            "animate": true
          },
          {
            "from": "eligible",
            "to": "result",
            "label": "Any eligibility condition fails",
            "status": "new",
            "transport": "flow",
            "shortLabel": "No"
          },
          {
            "from": "eligible",
            "to": "wait",
            "label": "All eligibility conditions hold",
            "status": "new",
            "transport": "flow",
            "shortLabel": "Yes"
          },
          {
            "from": "wait",
            "to": "attempt",
            "label": "Wait ends and time budget still permits an attempt",
            "status": "new",
            "transport": "flow",
            "animate": true,
            "shortLabel": "Try again"
          }
        ]
      }
    },
    {
      "id": "limits",
      "title": "Define limits and preserve the external contract",
      "status": "changed",
      "description": "Cap total attempts at three and keep waits within the request deadline.",
      "visual": {
        "template": "comparison",
        "rows": [
          {
            "label": "Total attempts",
            "before": "1",
            "after": "At most 3, including the first attempt",
            "status": "changed"
          },
          {
            "label": "Wait between attempts",
            "before": "Not present",
            "after": "200 ms, then 400 ms, when the remaining deadline permits",
            "status": "new"
          },
          {
            "label": "Jitter",
            "before": "Not present",
            "after": "An additional 0–100 ms per wait",
            "status": "new",
            "reason": "Reduce synchronized retries."
          },
          {
            "label": "Request deadline",
            "before": "Existing overall deadline",
            "after": "Existing overall deadline",
            "status": "unchanged"
          },
          {
            "label": "Response shape",
            "before": "Existing payload / error format",
            "after": "Existing payload / error format",
            "status": "unchanged"
          }
        ]
      }
    },
    {
      "id": "states",
      "title": "Record retry states for operational diagnosis",
      "status": "new",
      "description": "Record attempt counts and stop reasons without changing the client response.",
      "visual": {
        "template": "state-transitions",
        "nodes": [
          {
            "id": "attempting",
            "label": "Attempting",
            "status": "unchanged"
          },
          {
            "id": "waiting",
            "label": "Waiting to retry",
            "status": "new"
          },
          {
            "id": "finished",
            "label": "Finished",
            "status": "changed",
            "detail": "Success, ineligible failure, or exhausted budget."
          }
        ],
        "edges": [
          {
            "from": "attempting",
            "to": "waiting",
            "label": "Eligible failure and remaining budget",
            "status": "new",
            "shortLabel": "Retry allowed"
          },
          {
            "from": "waiting",
            "to": "attempting",
            "label": "Wait completes; budget permits another attempt",
            "status": "new",
            "shortLabel": "Try again"
          },
          {
            "from": "waiting",
            "to": "finished",
            "label": "Deadline or cancellation stops recovery",
            "status": "new",
            "shortLabel": "Deadline / cancel"
          },
          {
            "from": "attempting",
            "to": "finished",
            "label": "Success or retry policy declines recovery",
            "status": "changed",
            "shortLabel": "Success / stop"
          }
        ]
      }
    }
  ],
  "manualChanges": [
    {
      "change": "eligibility",
      "action": "Confirm which operations are safe to repeat before enabling retries.",
      "verification": "Unknown operations remain ineligible."
    },
    {
      "change": "limits",
      "action": "Validate attempt and wait limits against request latency and deadline.",
      "verification": "Confirm the deadline holds under transient failures."
    }
  ],
  "impact": [
    {
      "change": "limits",
      "basis": "expected",
      "description": "Retries add upstream calls and waiting."
    },
    {
      "change": "states",
      "basis": "expected",
      "description": "Retry logging may increase."
    }
  ],
  "risks": [
    {
      "change": "eligibility",
      "title": "Repeating an unsafe operation",
      "severity": "important",
      "condition": "An operation is misclassified as safe after its first attempt performed a side effect.",
      "consequence": "A retry can repeat the side effect.",
      "mitigation": "Confirm each operation with its upstream contract; leave unknown operations ineligible."
    },
    {
      "change": "limits",
      "title": "Amplifying an upstream outage",
      "severity": "important",
      "condition": "Concurrent requests retry the same transient failure.",
      "consequence": "Extra calls can increase load on an unhealthy upstream.",
      "mitigation": "Keep the attempt cap and jitter; validate upstream tolerance under load."
    }
  ]
}
